{"audit_sections":{"coordination":{"rejection_conditions":["a ligand, counterion or substrate contact changes outside its reviewed window","coordination or hapticity changes are silently treated as the same state"],"required_evidence":["one-based metal-donor map with reviewed distance windows","ligand count, denticity, hapticity and hemilability inventory","substrate, counterion, solvent and additive occupancy alternatives","pre/post geometry audit for coordination-number or binding-mode drift"],"status":"blocked_pending_review"},"electron_accounting":{"rejection_conditions":["any electron count or ligand-charge convention is inferred","electron parity and multiplicity are inconsistent or unreviewed"],"required_evidence":["reviewed ligand-charge and metal-metal bonding conventions","formal oxidation state and d-electron count for every metal","total valence-electron count, parity, charge and multiplicity consistency","explicit non-innocent-ligand alternatives"],"status":"blocked_pending_review"},"method_protocol":{"rejection_conditions":["a literature method is copied as an unreviewed default","any element lacks an explicit basis/ECP/relativity assignment"],"required_evidence":["three-tier protocol proposal after state review","basis/ECP and core-electron accounting for every element","relativity, dispersion, solvent, grid and SCF policies","spin-state, wavefunction and geometry/frequency sensitivity plan"],"status":"blocked_pending_review"},"spin_surface":{"rejection_conditions":["a multiplicity is selected from electron parity alone","different spin surfaces are mixed in one TS ensemble"],"required_evidence":["credible multiplicity inventory for the exact coordination state","common reference for spin-state comparisons","single-surface, spin-crossover and MECP relevance decision"],"status":"blocked_pending_review"},"ts_and_path":{"rejection_conditions":["frequency count alone is used to accept a TS","main-group IRC logic is used to claim metal path connectivity"],"required_evidence":["reviewed elementary-step class and atom correspondence","selected seed strategy with strategy-specific provenance","normal stationary-point and complete frequency evidence","exactly one raw imaginary mode reviewed for the intended coordinate and unintended coordination loss","metal-specific endpoint or crossing model appropriate to the reviewed surface"],"status":"blocked_pending_review"},"wavefunction":{"rejection_conditions":["SCF convergence is used as electronic-state validation","wavefunction stability, occupations or multireference risk remain unresolved"],"required_evidence":["explicit restricted, unrestricted, RO or broken-symmetry hypothesis","state-specific SCF stability and occupation-inspection policy","expected S(S+1), spin-contamination threshold and alternative-solution checks","system-appropriate single-reference or multireference diagnostics"],"status":"blocked_pending_review"}},"calculation_ready":false,"candidate_id":"metal_ts_r_unresolved","candidate_source":{"sha256":"00a724bf7fb2386cb4167603390cedfcf87c1cd3337dfe120730e77384f04f45"},"catalyst_state_id":"pd_ligand_state","channel_id":"metal_channel_r","claim_ceiling":"design_only_no_ts_or_selectivity_claim","design_source":{"sha256":"9de724589ddf0afe494ebceab50948f1b6471b159b6644ce2a100d036ac715c8"},"hard_rejections":["Do not render a Gaussian route or input from this template.","Do not stage, upload, submit, retry, cancel or clean up a metal job.","Do not promote the candidate while any audit section is blocked.","Do not reuse a checkpoint, Hessian, guess or energy across unreviewed electronic or coordination states.","Do not aggregate different spin surfaces without a separately reviewed crossing or kinetic model."],"identity_binding":{"atom_count":7,"atom_order":[{"element":"Pd","index":1,"role":"metal_center"},{"element":"P","index":2,"role":"chiral_ligand_donor"},{"element":"C","index":3,"role":"alkene_carbon_a"},{"element":"C","index":4,"role":"alkene_carbon_b"},{"element":"H","index":5,"role":"substrate_hydrogen"},{"element":"H","index":6,"role":"substrate_hydrogen"},{"element":"H","index":7,"role":"ligand_hydrogen"}],"charge":0,"coordinate_changes":[{"atoms":[1,4],"description":"Synthetic Pd-C contact change.","kind":"forming"}],"coordination_contacts":[{"acceptor_atom":1,"distance_window_angstrom":null,"donor_atom":3,"kind":"metal_coordination","review_status":"pending"},{"acceptor_atom":1,"distance_window_angstrom":null,"donor_atom":4,"kind":"metal_coordination","review_status":"pending"}],"metal_centers":[{"atom_index":1,"coordination_number":2,"d_electron_count":null,"element":"Pd","formal_oxidation_state":0,"geometry":"synthetic linear hypothesis","review_status":"unreviewed_hypothesis"}],"multiplicity":1},"mechanism_id":"metal_insertion_step","no_submission_authorization":true,"runtime_support_status":"unsupported_requires_extension","schema":"gaussian-asymmetric-metal-ts-audit-template/1","seed_strategy_gate":{"inventory":[{"status":"design_candidate_not_selected","strategy":"endpoint_qst2_qst3","strategy_id":"mts_5c0a97c0a365"},{"status":"design_candidate_not_selected","strategy":"reviewed_relaxed_coordinate_scan","strategy_id":"mts_6f8762f8e49a"},{"status":"design_candidate_not_selected","strategy":"single_guess_hessian_guided","strategy_id":"mts_177cb9ac4be6"}],"selected_strategy_id":null,"selection_required":true,"selection_status":"not_selected"},"status":"blocked_pending_scientific_review","study_id":"fixture_metal_selectivity","submission_decision":"refused","template_id":"metal_audit_52be387df11a","template_payload_sha256":"b7b212fc020ae44f7547d95e5acf0ce77683dfa1d4bd1437e840fc76b314602b"}
